s.fa96b327-c791-4bbb-a393-f66ce3b3395c.txt,0106023,24,1,1,Volkswirtschaftslehre,1,0,0,0,0,0,0,"",1,"","","","","","","","","","","","","","","","","","","","","","","","","","","","","","","","","","","","","","","","","","","","","","","","","","","","","","","","","","","","","","","","","","","","","","","","","","","","","","","","","","","","","","","","","","","","","","","","","","","","","","","","","","","","","","","","","","","","","","","","","","","","","","","","","","","","","","","","","","","","","","","","","","","","","","","","","","","","","","","","","","","","","","","","","","","",2023-12-05-20-03,"",""
s.5e511188-4121-44c8-b23b-637a2a4c4280.txt,0106023,20,1,1,Primarpädagogik ,1,1,0,1,0,0,0,"",1,"","","","","","","","","","","","","","","","","","","","","","","","","","","","","","","","","","","","","","","","","","","","","","","","","","","","","","","","","","","","","","","","","","","","","","","","","","","","","","","","","","","","","","","","","","","","","","","","","","","","","","","","","","","","","","","","","","","","","","","","","","","","","","","","","","","","","","","","","","","","","","","","","","","","","","","","","","","","","","","","","","","","","","","","","","","",2023-11-22-06-55,"",""
s.349a53c6-da5c-4836-bd92-7ef1a9450d06.txt,0106023,24,2,1,Informatik,1,1,0,0,0,0,0,"",1,"","","","","","","","","","","","","","","","","","","","","","","","","","","","","","","","","","","","","","","","","","","","","","","","","","","","","","","","","","","","","","","","","","","","","","","","","","","","","","","","","","","","","","","","","","","","","","","","","","","","","","","","","","","","","","","","","","","","","","","","","","","","","","","","","","","","","","","","","","","","","","","","","","","","","","","","","","","","","","","","","","","","","","","","","","","",2023-11-06-11-54,"",""
s.455363d4-147e-402b-b554-87abc5dd6f55.txt,0106023,19,1,1,Kommunikationswissenschaften und interkulturelles Musik und Veranstaltungsmanagement,1,1,0,0,0,0,0,"",1,"","",emo_parameters.2023-10-28-1428.data.455363d4-147e-402b-b554-87abc5dd6f55.txt,1,Die Stimmen klangen sehr ähnlich (als würden sie sich wiederholen),5,2,2,4,1,4,5,1,"Augen zu, habe mir vorgestellt mich würden diese Menschen mit diesem Wort begrüßen",ModularPROMS.2023-10-28-1455.data.455363d4-147e-402b-b554-87abc5dd6f55.txt,3,2,1,3,4,4,4,1,4,2,2,3,3,1,2,2,3,2,4,4,4,3,4,1,3,3,1,2,3,3,1,1,3,3,4,2,2,2,2,3,4,3,2,2,3,4,2,3,3,2,2,4,2,2,5,1,1,4,3,2,3,2,4,4,2,4,2,4,2,3,4,4,1,4,3,1,5,2,1,2,6,5,1,7,7,1,7,3,2,7,1,6,1,1,3,5,5,7,5,6,6,7,1,6,1,5,3,2,5,5,7,14 ,3,3,5,13,4,4,Geige und Gesang,5,1,1,5,2,6,1,3,Deutschland,Deutschland,4,2,4,3,1,3,2,1,1,3,2,1,4,3,3,1,4,3,1,1,O,N,B,7,1,U,"",2023-10-28-14-07,2023-10-28-15-23,76
s.11c4e182-4992-478a-b667-328482a6607f.txt,0106023,32,1,1,Molekularbiologin,2,0,1,0,0,0,0,"",1,"","",emo_parameters.2023-11-27-1153.data.11c4e182-4992-478a-b667-328482a6607f.txt,1,"Instruktionen waren gut verständlich~~bei einigen Stimmen war ich sehr unsicher, vor allem die Ziegenstimmen. :D",5,3,3,3,3,3,4,1,"bei zittrigen Stimmen meist Angst gewählt~~bei Stimmen, die hoch gehen meist Freude~~bei sehr monotonen Stimmen meist Trauer~~bei Worten die am Ende lang gezogen wurden oft Genuss",ModularPROMS.2023-11-27-1226.data.11c4e182-4992-478a-b667-328482a6607f.txt,3,2,2,3,3,4,4,2,4,2,2,3,3,4,1,3,2,4,3,4,4,3,3,3,2,1,1,2,2,3,1,3,3,2,3,2,3,2,4,2,4,4,2,2,3,2,3,1,3,2,5,4,3,4,5,1,2,4,2,3,4,5,5,4,2,2,1,4,3,2,4,5,4,3,3,2,2,3,4,4,6,5,1,5,6,6,6,5,1,6,3,5,1,3,2,5,4,7,6,6,5,6,1,3,5,6,2,2,6,5,7,10,3,3,1,14,4,2,Bratsche,6,2,2,"",2,6,9,2,Deutschland,Deutschland,3,1,4,2,1,3,1,1,1,3,2,1,3,1,3,2,4,3,2,2,R,R,L,1,6,O,"",2023-11-27-11-24,2023-11-27-12-59,95
s.d6d46022-b91a-4bc4-8526-682622575a7a.txt,0106023,27,2,1,Doktorand Physik,2,0,1,0,0,0,0,"",1,"","",emo_parameters.2023-12-26-1730.data.d6d46022-b91a-4bc4-8526-682622575a7a.txt,1,Die Instruktionen habe ich sehr gur verstanden.,4,3,4,5,2,5,5,2,Ich habe meine Bewertung nach der Tonlage der Stimmen und dessen Verlauf bewertet.,ModularPROMS.2023-12-26-1758.data.d6d46022-b91a-4bc4-8526-682622575a7a.txt,1,4,1,2,4,4,4,1,4,1,1,3,3,4,1,3,1,4,4,4,2,1,4,1,1,2,2,1,1,1,1,3,4,1,1,1,2,1,4,1,4,4,4,1,3,4,1,1,1,2,3,5,5,5,3,5,1,3,1,1,5,5,5,5,4,5,1,2,5,1,4,5,3,5,5,3,2,1,1,3,7,4,1,1,7,7,2,7,1,4,1,7,1,1,7,7,4,7,4,4,4,7,4,7,7,6,1,7,5,2,7,17,3,5,3,14 Jahre Waldhorn,2,6,Waldhorn,8,2,2,"",2,6,9,2,Deutschland,Deutschland,4,1,4,3,2,3,2,1,1,4,4,2,4,1,5,2,5,5,3,3,a,d,M,2,1,n,"",2023-12-26-17-05,2023-12-26-18-26,81
s.1e7685b8-0398-4c1c-9eb9-18efaecbc5c2.txt,0106023,31,2,3,Prüfingenieur,1,1,0,0,0,0,0,"",1,"","",emo_parameters.2023-07-25-2326.data.1e7685b8-0398-4c1c-9eb9-18efaecbc5c2.txt,1,"Wie beschrieben, kamen die Stimmen, nun bei machen Stimmen war ich bisschen langsam.",4,3,2,4,1,4,4,1,keine Strategie,ModularPROMS.2023-07-25-2355.data.1e7685b8-0398-4c1c-9eb9-18efaecbc5c2.txt,3,3,4,3,2,3,2,2,2,3,1,2,4,2,4,2,1,4,3,2,2,4,1,1,1,4,1,2,4,3,2,2,3,1,2,3,2,1,4,1,3,4,3,1,2,4,1,2,3,2,4,4,3,3,5,3,2,4,2,2,3,5,5,4,4,4,2,4,3,2,3,5,4,4,4,5,1,2,2,3,5,1,1,1,2,7,7,5,5,7,1,7,1,1,1,1,1,7,2,7,2,7,1,2,1,3,1,7,5,7,7,7,3,4,1,3,6,1,gesang,10,2,2,"",2,5,8,3,Indien,Deutschland,1,1,3,2,1,3,1,1,1,1,1,1,3,1,1,1,1,1,2,2,a,a,v,5,3,h,"",2023-07-25-23-06,2023-07-26-00-22,76
s.4ce23d13-b148-4b0c-9faa-44d0f88bdf93.txt,0106023,29,1,1,Lehrerin,1,1,0,0,0,0,0,"",1,"","",emo_parameters.2023-11-07-1741.data.4ce23d13-b148-4b0c-9faa-44d0f88bdf93.txt,1,"Alles verständlich, Signale zur schnellen Antwort teilweise irritierend",5,3,2,5,1,4,5,1,"Assoziationen für Gefühle gesucht, Situationen vorgestellt, Gerichtet nach Klang/Höhen/Abweichungen (z.B. zittrig)",ModularPROMS.2023-11-07-1809.data.4ce23d13-b148-4b0c-9faa-44d0f88bdf93.txt,1,2,1,2,2,2,4,1,2,1,2,1,3,1,1,1,2,3,3,4,3,3,1,1,2,3,2,3,3,3,2,2,2,2,3,2,2,1,3,1,2,3,2,1,3,3,1,1,3,2,3,5,4,4,5,3,2,3,3,2,4,4,3,3,5,5,2,4,2,1,3,4,4,4,5,2,2,2,2,1,7,6,3,5,7,7,7,7,1,7,3,7,1,1,5,6,5,7,7,7,7,7,1,7,1,5,1,5,7,5,7,23,4,3,7,18,5,4,Gesang,7,1,1,5,2,6,9,4,Deutschland,Deutschland,3,4,5,4,3,3,1,1,1,4,4,4,4,1,3,4,5,4,2,1,i,e,Q,5,8,e,"",2023-11-07-17-19,2023-11-07-18-24,65
s.a486dad1-17f2-4615-8035-4f9deac06b9a.txt,0106023,26,1,1,Doktorandin Linguistik,2,0,1,0,0,0,1,Kammermusik,1,"","",emo_parameters.2023-08-08-2136.data.a486dad1-17f2-4615-8035-4f9deac06b9a.txt,1,"manchmal hat keine Emotion gepasst, dann habe ich nicht oder irgendetwas gedrückt",1,3,1,5,2,2,5,2,nein,ModularPROMS.2023-08-08-2202.data.a486dad1-17f2-4615-8035-4f9deac06b9a.txt,2,2,2,3,4,4,4,2,4,2,2,2,1,3,2,2,2,3,4,3,3,2,3,3,2,3,2,2,1,3,3,2,3,3,3,3,2,2,3,3,4,2,2,2,3,3,2,2,3,4,4,4,2,4,5,5,4,5,4,1,3,3,5,4,4,4,1,5,4,1,3,5,4,4,5,3,3,2,2,2,7,6,1,5,6,5,5,7,2,6,2,7,1,1,7,6,2,5,5,5,1,6,2,6,3,7,3,5,3,2,7,10,6,7,1,6,4,4,Geige,8,1,2,"",2,6,9,2,Deutschland,Deutschland,2,2,2,2,2,2,1,1,1,2,1,2,4,1,1,2,3,3,2,2,A,R,B,7,3,L,"'einigermaßen' ist für mich weniger stark als 'ein bisschen', würde es also in der Skala vertauschen",2023-08-08-21-15,2023-08-08-22-20,65
s.b0563922-5b53-4472-9a6f-2344d2c85502.txt,0106023,18,2,1,Gymnasiallehramt,2,1,0,0,0,0,0,"",1,"","","","","","","","","","","","","","","","","","","","","","","","","","","","","","","","","","","","","","","","","","","","","","","","","","","","","","","","","","","","","","","","","","","","","","","","","","","","","","","","","","","","","","","","","","","","","","","","","","","","","","","","","","","","","","","","","","","","","","","","","","","","","","","","","","","","","","","","","","","","","","","","","","","","","","","","","","","","","","","","","","","","","","","","","","","",2023-12-30-19-10,"",""
s.2a9cb787-1bba-41ac-9a07-12b3ce18effb.txt,0106023,23,1,1,Bachelor of Science Geographie,1,1,0,0,1,0,0,"",2,Tinnitus,2,"","","","","","","","","","","","","","","","","","","","","","","","","","","","","","","","","","","","","","","","","","","","","","","","","","","","","","","","","","","","","","","","","","","","","","","","","","","","","","","","","","","","","","","","","","","","","","","","","","","","","","","","","","","","","","","","","","","","","","","","","","","","","","","","","","","","","","","","","","","","","","","","","","","","","","","","","","","","","","","","","","","","","","","","","",2023-11-21-21-43,"",""
s.a0df5d05-d76a-4c51-8e34-54400129a79c.txt,0106023,54,2,1,Ingenieur,2,0,1,0,0,0,0,"",1,"","",emo_parameters.2023-11-18-1249.data.a0df5d05-d76a-4c51-8e34-54400129a79c.txt,1,Instruktionen verständlich. Die verzerrten Stimmen machten es mir etwas schwer die Stimmungen richtig zuzuordnen.,3,4,3,5,1,4,5,3,"Eigentlich habe ich keine ""Strategie"" entwickelt sondern versucht ""dem Klang der Stimme nachzuhören"" und zu entscheiden welche Stimmung am ehesten zutrifft. Freude meinte ich am ehesten hören zu können.",ModularPROMS.2023-11-18-1326.data.a0df5d05-d76a-4c51-8e34-54400129a79c.txt,3,2,1,4,3,2,4,1,4,2,2,2,3,2,2,1,2,2,4,4,3,3,3,2,3,4,2,2,1,3,2,3,3,3,4,2,1,2,4,4,4,3,2,3,3,3,2,3,2,3,3,4,2,4,5,3,3,2,1,1,4,4,4,3,3,2,1,4,3,2,3,4,5,3,5,2,3,2,3,1,5,1,1,3,6,5,2,5,1,5,3,6,2,2,3,5,3,6,5,6,6,6,2,5,5,5,7,3,2,2,7,44,6,5,1,12,2,3,Violine,7,2,2,"",2,6,10,5,Deutschland,Deutschland,4,3,5,3,2,3,1,2,1,4,1,2,4,2,4,2,3,4,1,2,N,N,W,0,4,N,Ich empfand die Teilnahme ordentlich anspruchsvoll !,2023-11-18-12-25,2023-11-18-14-07,102
s.a16e9868-532e-4611-98b6-4767929dad4d.txt,0106023,19,2,1,Philosophie B.A.,1,1,0,0,1,0,0,"",1,"","",emo_parameters.2023-12-15-2107.data.a16e9868-532e-4611-98b6-4767929dad4d.txt,1,"-Instruktionen waren verstädnlich~~-Währenddessen manchmal etwas unter Druck, schnell abliefern zu müssen~~-einige sehr wenige ""Stimmen"" waren derart verzerrt, dass ich gar keine Emotion erahnen konnte",5,2,2,4,2,4,5,1,"-Ein ""Flattern"" in der Stimme deutete meistens auf Freude oder Angst hin~~-hohe Männer-/Frauenstimmen wirkten häufig unentspannt und damit auch eher wie Freude und Angst~~-bei tiefen Männer-/Frauenstimmen hatte ich das Gefühl von stimmlicher Gesetztheit und Entspannung, das deutete für mich auf Genuss oder Trauer hin ~~-gingen die Stimmmelodien tendenziell von oben nach unten, so wirkte das ebenfalls eher entspannend und damit wie Genuss oder Trauer~~-gingen die Stimmmelodien tendenziell von unten nach oben (Gluckser/Erschrecken o.ä.) spürte ich tendenziell Angst oder überschwängliche Freude",ModularPROMS.2023-12-15-2143.data.a16e9868-532e-4611-98b6-4767929dad4d.txt,2,4,1,3,4,1,3,2,2,2,2,1,2,1,1,1,1,2,3,3,2,3,2,2,3,3,1,3,2,4,1,2,3,2,3,1,4,1,2,3,2,4,1,1,3,3,2,3,1,3,3,3,4,5,5,5,2,5,4,2,3,2,5,5,5,5,3,5,4,1,1,5,5,5,5,4,5,3,3,1,7,7,1,6,6,7,7,5,1,7,1,7,1,1,7,7,7,7,7,7,1,7,1,1,1,7,1,5,7,5,7,7,6,7,5,"12,5",5,6,Trompete,6,1,2,"",2,6,1,3,Deutschland,Deutschland,4,4,2,4,1,3,2,1,2,3,3,1,2,1,3,2,3,3,5,2,U,O,R,6,6,R,"",2023-12-15-20-36,2023-12-15-22-08,92
s.d3ade742-20c1-4b2e-9a2b-c1e1b7e0e5c7.txt,"","","","","","","","","","","","","","","","","","","","","","","","","","","","","","","","","","","","","","","","","","","","","","","","","","","","","","","","","","","","","","","","","","","","","","","","","","","","","","","","","","","","","","","","","","","","","","","","","","","","","","","","","","","","","","","","","","","","","","","","","","","","","","","","","","","","","","","","","","","","","","","","","","","","","","","","","","","","","","","","","","","","","","","","","","","","","","","","","","","","","","","","","",2023-11-23-21-43,"",""
s.96c53bc6-cad0-489d-b252-39f0e00e2a3c.txt,0106023,23,1,1,Bachelor of science Geographie,1,1,0,0,1,0,0,"",2,Tinnitus,2,"","","","","","","","","","","","","","","","","","","","","","","","","","","","","","","","","","","","","","","","","","","","","","","","","","","","","","","","","","","","","","","","","","","","","","","","","","","","","","","","","","","","","","","","","","","","","","","","","","","","","","","","","","","","","","","","","","","","","","","","","","","","","","","","","","","","","","","","","","","","","","","","","","","","","","","","","","","","","","","","","","","","","","","","","",2023-11-21-21-54,"",""
s.3436adf8-42fc-434a-9178-92aaa617a0f5.txt, 0106023,30,1,1,Ärztin,2,0,1,0,0,0,0,"",1,"","",emo_parameters.2023-12-05-1915.data.3436adf8-42fc-434a-9178-92aaa617a0f5.txt,2,Habe zu schnell weiter gedrückt.,4,5,5,4,2,3,5,2,Auf Nuancen der Stimme zu achten z.B. Zittern der Stimme,ModularPROMS.2023-12-05-1948.data.3436adf8-42fc-434a-9178-92aaa617a0f5.txt,2,2,2,2,4,3,3,2,2,3,2,3,2,3,1,3,2,3,2,3,1,2,2,3,2,2,3,1,3,2,1,2,1,3,2,3,2,2,4,3,3,3,2,2,3,2,2,3,3,2,3,4,2,4,5,2,4,4,3,2,4,4,4,2,3,2,2,4,3,4,3,5,4,2,4,4,4,3,3,4,6,5,2,6,6,3,3,3,1,4,3,4,5,2,5,7,2,5,6,5,3,6,2,5,5,6,2,4,3,3,5,15,7,3,4,8,3,3,Violoncello,10,2,2,"",2,6,9,4,Deutschland,Deutschland,2,3,4,2,1,3,3,1,1,2,2,1,3,3,4,1,3,5,3,2,E,A,L,5,3,R,"",2023-12-05-18-50,2023-12-05-20-08,78
s.bf125ec1-4b3b-4d18-9f5e-79ad95c7a9cf.txt,0106023,44,2,1,Informatiker,2,0,1,0,0,1,0,"",1,"","",emo_parameters.2023-10-25-0002.data.bf125ec1-4b3b-4d18-9f5e-79ad95c7a9cf.txt,1,"viele der 'Artikulationen' konnte ich einfach nicht in die 4 vorgegebenen Kategorien einordnen, waren z.B. beiläufig/emotionslos, oder waren eher anklagend/aggressiv, .. ~~ich weiß nicht ob die Reaktionszeit mit vermessen wird, aber mir fehlten da ggf. noch ein paar Emotionen zur Auswahl",4,4,3,5,3,3,4,2,"zuerst eher negativ (DF) oder positiv (JK), ~~dann klingts z.B. traurig, dann das, sonst das andere, freudig oder sonstiges ",ModularPROMS.2023-10-25-0035.data.bf125ec1-4b3b-4d18-9f5e-79ad95c7a9cf.txt,2,2,1,3,4,4,3,1,3,2,2,2,4,1,2,2,3,4,1,3,1,3,2,2,3,3,1,2,3,3,2,2,3,3,3,2,1,2,3,3,2,4,3,2,4,3,2,2,3,3,4,4,4,2,5,4,3,5,1,1,3,5,5,5,4,4,3,1,4,1,3,4,4,4,4,3,2,3,2,1,7,5,2,5,6,5,6,6,2,6,2,6,2,1,7,6,5,7,6,5,1,6,2,6,3,6,1,6,4,2,7,30,5,5,4,10,3,7,Posaune,12,1,2,"",2,6,9,3,DDR,Deutschland,3,2,4,3,1,3,1,1,1,4,2,1,3,1,3,2,2,3,2,1,l,s,l,5,2,n,"",2023-10-24-23-36,2023-10-25-00-55,79
s.0c373baf-60fe-4d6d-8921-1000a67e3eb6.txt,0106023,25,1,1,Medienpädagogin,2,1,0,1,0,0,0,"",1,"","",emo_parameters.2023-12-05-1617.data.0c373baf-60fe-4d6d-8921-1000a67e3eb6.txt,1,"hatte keine Verständnisprobleme. Hilfreich war das erneute Zeigen der Tastaturbelegung, auch wenn man ab dem zweiten Block dann auf jeden Fall drinnen war.",4,3,2,5,1,5,5,2,"Vor allem auf die Klangfarbe, die Schnelligkeit der Aussprache (euphorisch schnell oder getragener) und den emotionalen Eindruck, den ich von der Stimme erhalten habe~~",ModularPROMS.2023-12-05-1643.data.0c373baf-60fe-4d6d-8921-1000a67e3eb6.txt,1,2,1,3,3,4,4,1,4,2,4,2,3,3,1,3,1,3,4,4,4,3,3,1,1,3,2,3,2,3,2,2,2,3,1,1,1,1,3,2,4,4,3,1,3,2,1,1,2,1,4,5,2,2,5,3,1,3,2,3,4,5,5,5,4,4,1,5,4,1,4,5,5,4,4,2,2,1,1,1,6,5,1,5,6,7,7,5,1,6,2,7,1,1,6,7,3,5,5,7,1,6,2,5,1,6,2,6,6,4,7,14,3,6,5,14,3,5,Gitarre,4,2,2,"",2,6,9,3,Deutschland,Deutschland,3,1,5,4,1,3,1,1,1,4,3,1,3,1,3,2,3,4,2,1,N,I,R,4,6,E,"",2023-12-05-15-58,2023-12-05-16-52,54
s.8aac6581-bed8-40f8-97da-2c75f51c6a08.txt,0106023,24,1,1,Chemische Biologie,2,0,1,0,0,0,0,"",1,"","",emo_parameters.2023-10-24-2005.data.8aac6581-bed8-40f8-97da-2c75f51c6a08.txt,1,"ja, es war verständlich. Stimmen manchmal komisch",5,3,2,5,2,3,5,1,"Tonhöhenverlauf der Stimme, schnelle oder langsame Anderung der Höhe, langgezogene Vokale oder Konsonanten, vorgestellt es handele sich um einen Namen",ModularPROMS.2023-10-24-2035.data.8aac6581-bed8-40f8-97da-2c75f51c6a08.txt,2,2,2,2,2,1,4,3,2,2,2,1,4,3,2,2,2,4,1,3,3,3,2,2,2,3,2,3,3,3,2,2,3,2,3,2,2,2,3,2,3,4,4,2,3,2,2,2,4,2,4,5,4,5,5,3,3,5,5,2,2,4,4,3,3,3,1,4,3,1,2,5,3,3,4,3,4,2,2,3,5,5,1,3,5,6,3,5,1,5,4,5,6,1,4,6,2,6,4,6,5,5,2,3,5,3,6,5,3,2,7,1,4,4,7,13,3,2,Geige,6,2,2,"",2,6,7,4,Deutschland,Deutschland,3,4,3,3,1,2,1,1,1,1,1,1,3,1,2,1,3,3,1,1,U,H,G,7,1,H,"",2023-10-24-19-38,2023-10-24-20-56,78
s.dfb67739-164e-43e9-9443-b7be600a2a20.txt,0106023,30,2,1,Arzt,2,0,0,1,0,0,0,"",1,"","",emo_parameters.2024-01-21-1651.data.dfb67739-164e-43e9-9443-b7be600a2a20.txt,1,"manche Beispiele wirkten etwas abgehackt, sodass ich mir nicht immer sicher war, welche Emotion damit verbunden sein könnte.~~",5,3,2,5,1,3,5,1,"Melodie der Stimme, Artikulation der Stimme, Dynamik der Stimme, Geschwindigkeit der Aussprache","","","","","","","","","","","","","","","","","","","","","","","","","","","","","","","","","","","","","","","","","","","","","","","","","","","","","","","","","","","","","","","","","","","","","","","","","","","","","","","","","","","","","","","","","","","","","","","","","","","","","","","","","","","","","","","","","","","","","","","","","","","","","","","","","","","","","","","","","","","","","","","","","","","","","","","","","","","","","",2024-01-21-16-25,"",""
s.72bc82de-d5e7-4e87-acf2-43fcd6fc8611.txt,0106023,18,1,1,Psychologie Studentin,1,1,0,0,0,0,0,"",1,"","",emo_parameters.2023-11-02-1702.data.72bc82de-d5e7-4e87-acf2-43fcd6fc8611.txt,1,einige stimmen waren sehr verzerrt. und für mich war die sog. emotion genuss sehr schwer einzuordnen,4,3,4,5,1,4,4,2,die unterschiedlichen stimmen miteinander vergleichen. bspw. wenn ich mir bei einer emotion sicher war und sich eine andere stimme ähnlich angehört hat,ModularPROMS.2023-11-02-1728.data.72bc82de-d5e7-4e87-acf2-43fcd6fc8611.txt,2,2,1,2,1,2,3,1,4,2,2,2,2,3,2,2,2,3,4,4,4,4,2,2,2,3,2,3,2,3,2,1,3,2,4,2,2,3,3,1,1,3,3,3,3,3,2,2,3,3,1,4,2,5,4,5,4,3,2,1,4,4,4,3,4,3,1,5,3,3,2,5,5,4,5,4,5,3,3,2,6,6,1,3,6,7,7,3,7,6,3,5,1,1,4,6,5,6,3,5,3,6,2,6,2,1,2,1,6,5,7,6,2,2,1,8,2,3,Klavier,11,2,2,"",2,6,1,5,Deutschland,Deutschland,4,2,5,4,1,3,1,1,4,5,4,2,4,1,4,3,5,5,2,2,N,S,W,8,8,R,"",2023-11-02-16-44,2023-11-02-17-43,59
s.2cb635f0-b4c2-4785-8c93-f8302317733b.txt,0106023,31,2,1,Geschäftsführer im Sportmanagement,1,1,0,0,0,0,0,"",1,"","",emo_parameters.2023-10-25-1636.data.2cb635f0-b4c2-4785-8c93-f8302317733b.txt,1,Hat alles wunderbar geklappt. Keine Probleme.,2,3,2,5,2,2,5,4,"- nach Gefühl~~- bei zittriger Stimme zu Angst tendiert, auch wenn es vielleicht and der Bearbeitung/Aufnahme lag.",ModularPROMS.2023-10-25-1704.data.2cb635f0-b4c2-4785-8c93-f8302317733b.txt,2,3,3,3,3,4,4,2,4,2,2,2,4,1,1,2,3,4,4,3,2,2,3,3,1,3,3,2,1,2,3,2,3,2,4,3,2,2,3,2,4,3,4,2,3,3,2,1,1,1,2,4,4,2,4,4,2,5,3,3,3,4,4,4,3,3,2,2,4,2,2,4,3,4,2,2,3,2,1,1,5,3,1,2,6,6,7,5,3,7,3,5,2,1,2,5,3,6,5,6,6,5,2,2,1,5,5,1,5,1,6,0,2,5,2,1,2,1,Gesang,20,2,2,"",2,6,9,3,Deutschland,Deutschland,2,1,2,1,1,3,1,1,1,2,2,1,1,1,3,1,2,3,1,1,A,R,M,3,9,A,"",2023-10-25-16-16,2023-10-25-17-21,65
s.f0979bc5-a584-48b1-865b-29a2b6586471.txt,0106023,50,1,1,Physikingenieur,2,0,1,1,0,0,0,"",1,"","",emo_parameters.2023-10-09-1355.data.f0979bc5-a584-48b1-865b-29a2b6586471.txt,1,"",3,5,3,4,2,4,5,1,"Zittern in der Stimme=Angst, lange m-Laute=Genuss",ModularPROMS.2023-10-09-1422.data.f0979bc5-a584-48b1-865b-29a2b6586471.txt,1,2,2,2,4,2,4,3,2,1,1,1,4,3,2,2,1,3,1,2,4,4,2,2,2,3,1,2,4,3,2,2,4,2,3,2,2,1,3,2,4,3,4,1,3,3,2,2,3,1,4,4,3,2,5,5,3,4,1,4,4,4,5,3,4,4,1,2,4,2,1,5,3,3,2,2,2,3,2,1,7,3,1,6,7,3,4,2,2,7,3,5,3,1,4,2,3,7,5,6,3,7,2,6,2,5,1,2,3,1,5,0,2,6,3,10,4,1,Querflöte,6,2,2,"",2,6,9,5,Deutschland,Deutschland,3,1,4,2,1,2,1,1,1,3,2,1,2,1,3,3,3,4,2,1,E,H,W,0,5,E,"",2023-10-09-13-33,2023-10-09-14-36,63
s.bfcba761-16fb-4384-9441-eece7eabca12.txt,0106023,28,2,1,Chemie,1,1,0,0,0,0,0,"",1,"","",emo_parameters.2023-12-17-1831.data.bfcba761-16fb-4384-9441-eece7eabca12.txt,1,"Übung war grundsätzlich berständlich. Manchmal gab es Momente, in denen ich keine Entscheidung treffen konnte, weil für mich nichts zutraf. Das Testdesign ist so aufgebaut, dass ich im Zweifel lieber eine zufällige Auswahl treffe, um das ""Fehlerbild"" zu vermeiden. habe dann aber im Laufe des Tests mich entschieden eher keine Entscheidung zu treffen",2,4,2,5,2,3,5,4,"Habe mir Menschen vorgestellt, die das Wort sagen",ModularPROMS.2023-12-17-1900.data.bfcba761-16fb-4384-9441-eece7eabca12.txt,2,1,2,3,2,3,4,2,4,4,1,1,3,2,2,2,2,2,3,4,4,4,4,4,3,4,2,2,3,3,2,3,4,2,4,2,2,1,3,4,3,4,1,1,4,4,1,2,3,2,4,4,2,2,4,4,1,4,2,2,4,4,4,4,4,4,1,5,3,3,1,5,3,5,5,2,4,2,2,2,5,5,1,2,5,5,5,3,1,7,3,2,3,6,2,4,2,7,3,5,7,6,2,2,2,3,6,2,3,5,3,3,2,2,1,6,2,1,Gesang,5,2,2,"",2,6,9,4,Deutschland,Deutschland,4,1,5,3,2,4,3,1,1,3,1,1,1,1,4,1,4,4,1,1,a,t,m,2,2,i,"",2023-12-17-18-03,2023-12-17-19-13,70
s.30606109-729e-4657-ae42-d300863033bd.txt,0106023,42,1,1,Jurist,2,0,1,0,0,0,0,"",1,"","",emo_parameters.2023-11-26-1216.data.30606109-729e-4657-ae42-d300863033bd.txt,1,"",5,3,2,5,2,5,5,2,"",ModularPROMS.2023-11-26-1243.data.30606109-729e-4657-ae42-d300863033bd.txt,3,2,2,2,2,2,4,1,3,2,2,3,1,4,2,2,2,2,2,4,4,3,3,3,2,3,1,1,3,1,1,2,4,3,4,1,2,2,4,2,1,4,2,2,3,1,2,1,4,2,3,5,4,5,5,2,2,5,2,2,3,2,5,3,2,2,1,4,3,1,4,5,4,3,5,4,4,2,2,3,4,4,1,4,7,6,6,4,1,6,1,6,2,2,4,5,3,7,5,5,4,7,1,4,3,7,5,1,6,3,7,30,2,5,4,14,2,6,Bratsche,8,2,2,"",2,6,9,4,DDR/BRD/Thüringen,BRD,3,2,4,2,1,2,1,1,1,3,2,1,2,1,3,2,2,5,1,1,A,H,J,7,5,H,Das war sehr interessant und ich bin gespannt auf die Ergebnisse :),2023-11-26-11-54,2023-11-26-13-18,84
s.37e8ff36-bea2-4101-a0cb-cabf8aca3bdd.txt,0106023,20,2,1,Studium: Bauingenieurwesen Bachelor,1,1,0,0,1,0,0,"",1,"","",emo_parameters.2023-12-19-1854.data.37e8ff36-bea2-4101-a0cb-cabf8aca3bdd.txt,1,Instruktionen sehr verständlich~~,3,3,2,5,1,3,5,2,"keine Strategie, eher nach Gefühl bzw teilweise habe ich mir vorgestellt, welcher Gesichtsausruck zum Tonbeispiel gepasst hätte und daran entschieden",ModularPROMS.2023-12-19-1922.data.37e8ff36-bea2-4101-a0cb-cabf8aca3bdd.txt,2,2,1,3,2,4,3,2,4,4,2,1,4,4,1,3,2,4,1,3,2,3,2,3,3,1,2,3,3,2,1,2,3,4,3,3,3,1,3,2,4,2,2,1,3,3,2,1,3,4,4,2,1,2,5,4,4,5,2,1,3,5,5,5,3,2,2,5,2,1,2,5,4,4,5,4,1,2,1,4,7,6,2,6,6,5,7,5,1,7,2,6,1,2,6,5,6,7,5,3,3,6,2,7,1,5,1,5,2,3,7,10,5,5,5,11,3,3,Gesang,6,1,2,"",2,6,1,4,Deutschland,Deutschland,2,1,4,5,1,3,1,1,1,3,4,1,4,1,2,1,2,3,2,1,N,S,D,5,3,O,"",2023-12-19-18-33,2023-12-19-19-42,69
s.037909a5-931b-4ba1-944a-75a9dcd8e33b.txt,0106023,21,1,1,Medizin,1,1,0,0,0,0,0,"",1,"","",emo_parameters.2023-10-29-1729.data.037909a5-931b-4ba1-944a-75a9dcd8e33b.txt,3,Instruktionen waren verständlich,3,3,2,3,3,4,4,1,Hören auf Stimmhebungen und Stimmsenkungen,ModularPROMS.2023-10-29-1756.data.037909a5-931b-4ba1-944a-75a9dcd8e33b.txt,1,2,2,3,4,4,3,2,4,1,1,3,4,3,2,1,1,3,4,3,3,3,3,1,3,3,2,3,3,2,2,2,3,2,2,2,3,1,3,1,4,3,1,1,3,2,1,2,2,2,3,4,2,5,5,3,4,2,2,4,3,5,4,1,2,4,2,4,1,2,2,4,4,3,2,2,3,2,4,3,7,5,1,3,6,6,4,5,1,6,2,6,2,1,5,5,3,5,6,6,2,6,2,5,2,6,2,2,2,2,6,10,3,6,1,10,5,3,Klavier,8,1,2,"",2,6,1,5,Deutschland,Deutschland,3,2,3,2,1,1,1,1,1,1,3,2,3,1,4,2,3,3,1,1,O,T,M,8,2,N,"",2023-10-29-17-09,2023-10-29-18-18,69
s.9f3d7bfa-8954-4383-9332-2c78ac31d7f9.txt,0106023,24,1,1,Mathematik,1,1,0,0,0,0,0,"",1,"","",emo_parameters.2023-12-12-1805.data.9f3d7bfa-8954-4383-9332-2c78ac31d7f9.txt,1,manchmal andere Gefühle gehört als es als Auswahl gab,4,3,2,5,1,2,4,2,"",ModularPROMS.2023-12-12-1831.data.9f3d7bfa-8954-4383-9332-2c78ac31d7f9.txt,2,2,3,3,4,3,3,3,4,2,2,2,3,4,1,2,2,3,1,4,4,3,2,2,2,2,1,2,4,2,2,2,4,2,4,2,3,2,3,1,4,4,2,2,3,1,2,2,3,2,3,4,3,4,5,3,2,4,4,3,3,4,4,3,2,3,1,4,3,2,4,5,4,2,4,2,2,2,2,4,6,5,2,3,5,5,6,5,1,6,3,5,3,2,4,6,5,5,4,5,4,5,2,5,5,5,2,3,5,3,6,8,3,6,3,8,3,3,Gesang,6,2,2,"",2,6,1,3,Deutschland,Deutschland,3,2,3,1,1,2,2,1,1,2,1,1,2,2,3,2,3,4,2,3,I,B,D,5,7,N,"",2023-12-12-17-41,2023-12-12-18-49,68
s.3d0ac32a-28c5-4fb6-932e-518dd10abd99.txt,"","","","","","","","","","","","","","","","","","","","","","","","","","","","","","","","","","","","","","","","","","","","","","","","","","","","","","","","","","","","","","","","","","","","","","","","","","","","","","","","","","","","","","","","","","","","","","","","","","","","","","","","","","","","","","","","","","","","","","","","","","","","","","","","","","","","","","","","","","","","","","","","","","","","","","","","","","","","","","","","","","","","","","","","","","","","","","","","","","","","","","","","","",2023-12-22-12-41,"",""
s.3c48d5b5-430e-4422-99ee-c517d1beea79.txt,"","","","","","","","","","","","","","","","","","","","","","","","","","","","","","","","","","","","","","","","","","","","","","","","","","","","","","","","","","","","","","","","","","","","","","","","","","","","","","","","","","","","","","","","","","","","","","","","","","","","","","","","","","","","","","","","","","","","","","","","","","","","","","","","","","","","","","","","","","","","","","","","","","","","","","","","","","","","","","","","","","","","","","","","","","","","","","","","","","","","","","","","","",2024-01-24-18-20,"",""
s.c4d4e3df-e3a9-4435-84a9-db9c324cea26.txt,0106023,21,1,1,Anglistik/Amerikanistik und Management,2,0,0,1,0,0,1,Musikkapelle,1,"","",emo_parameters.2023-12-12-1413.data.c4d4e3df-e3a9-4435-84a9-db9c324cea26.txt,1,"war alles verständlich, nach einer weile wusste man auch, welche tastatur welche emotion beschreibt",5,2,2,4,2,1,5,1,"ich habe die augen geschlossen und versucht, mich nur auf den klang und die emotion zu fokussieren",ModularPROMS.2023-12-12-1437.data.c4d4e3df-e3a9-4435-84a9-db9c324cea26.txt,2,1,2,1,3,3,2,3,4,4,3,2,3,2,1,2,2,4,4,4,4,1,3,1,2,1,3,1,3,4,1,2,4,1,1,3,4,2,4,2,1,4,1,3,3,1,4,3,4,2,3,5,4,5,5,4,3,5,3,2,1,5,5,2,1,3,1,5,5,1,5,5,3,1,3,5,3,2,4,2,7,7,1,1,7,7,7,7,1,5,1,5,1,1,4,7,3,7,7,4,4,7,1,7,7,7,1,1,3,1,7,14,5,3,7,10,3,7,Trompete,6,1,2,"",2,6,1,1,Deutschland,Deutschland,2,4,5,3,1,3,2,1,1,3,4,2,5,1,3,4,4,4,3,2,o,p,m,2,1,i,"",2023-12-12-13-52,2023-12-12-14-49,57
s.d61f7171-0e92-4732-8aa7-478ba9b0b4b1.txt,0106023,18,1,1,Psychologie Studentin,1,1,0,0,0,0,0,"",1,"","","","","","","","","","","","","","","","","","","","","","","","","","","","","","","","","","","","","","","","","","","","","","","","","","","","","","","","","","","","","","","","","","","","","","","","","","","","","","","","","","","","","","","","","","","","","","","","","","","","","","","","","","","","","","","","","","","","","","","","","","","","","","","","","","","","","","","","","","","","","","","","","","","","","","","","","","","","","","","","","","","","","","","","","","","",2023-10-30-18-22,"",""
