s.d10314aa-43e2-48c9-8b92-96c4a80befde.txt,0106023,22,1,1,Psychologie,2,0,1,0,0,0,1,Blaskapelle,1,"","",emo_parameters.2023-12-13-1013.data.d10314aa-43e2-48c9-8b92-96c4a80befde.txt,1,"- Die Instruktionen waren klar~~- Nein, ich konnte mich nur oft nicht entscheiden~~- Ich glaube, meine Zwillingsschwester und ich haben an diesem Experiment teilgenommen, in dem diese Stimmaufnahmen gemacht wurden",3,5,3,5,2,3,5,2,"- Stimmen die eher ""zitterten"" habe ich meistens ""Angst"" zugeordnet (oder am Ende fragend nach oben gehen)~~- Stimmen die am Ende in der Tonlage nach unten gehen, habe ich meist ""Trauer"" zugeordnet~~- Ausrufe, die ind er Tonlage nach oben gehen habe ich meist ""Freude"" zugeordnet (obwohl man ""Freude"" auch so gut erkannt hat)~~- Genuss war alles, was irgendwie neutral klang (manche waren eindeutig genießend, meist raunend oder eben genießend)",ModularPROMS.2023-12-13-1042.data.d10314aa-43e2-48c9-8b92-96c4a80befde.txt,3,2,2,2,2,4,4,2,4,2,2,2,1,3,1,1,3,4,3,3,4,3,3,1,3,1,2,2,1,3,2,3,4,3,3,2,3,2,3,3,4,4,1,2,4,1,3,1,1,3,4,5,1,5,5,3,2,3,3,4,4,5,4,4,3,1,1,5,4,2,5,5,4,3,2,4,4,2,1,2,7,7,2,5,6,7,7,5,1,6,1,6,1,1,7,7,6,7,5,6,3,6,1,7,2,5,1,1,3,3,7,12,4,4,1,8,2,6,Trompete (Gesang fast gleichermaßen),10,2,2,"",2,6,1,2,Deutschland,Deutschland,3,1,4,3,1,2,1,1,1,3,2,1,1,1,4,2,3,4,1,1,A,H,L,0,0,A,"",2023-12-13-09-48,2023-12-13-11-01,73
s.cef5f6b7-dd36-4996-bfc9-71b6265c651e.txt,0106023,24,2,1,Informatik,1,1,0,0,0,0,0,"",1,"","",emo_parameters.2023-11-28-1509.data.cef5f6b7-dd36-4996-bfc9-71b6265c651e.txt,1,Einige Sounds waren sehr schwer einzuschätzten aufgrund der Kürze und Verzerrung,5,3,2,5,2,5,5,1,"Ich habe mir Menschen in Situationen vorgestellt, die diese Laute von sich geben.",ModularPROMS.2023-11-28-1534.data.cef5f6b7-dd36-4996-bfc9-71b6265c651e.txt,2,2,1,2,3,3,4,2,4,2,2,1,4,2,3,1,2,4,1,3,3,4,1,2,3,3,2,3,3,3,2,2,3,2,4,2,3,1,4,3,3,3,2,2,3,3,1,3,2,2,3,4,2,1,4,2,3,2,2,1,4,4,3,2,4,4,1,4,3,2,2,4,4,4,5,1,3,2,2,1,5,6,1,5,2,6,7,4,2,7,2,6,2,1,2,6,5,7,5,5,4,6,1,5,3,5,6,2,4,3,7,2,4,4,1,0,1,7,Gesang,0,2,2,"",2,6,9,3,Deutschland,Deutschland,4,1,5,5,2,2,1,1,1,4,4,1,5,1,4,2,4,4,3,2,A,N,J,1,8,A,"",2023-11-28-14-44,2023-11-28-15-55,71
s.4d4a3afb-d7a0-4e43-9855-0af6fd29b2f1.txt,0106023,48,2,1,IT-Angestellter,2,0,1,0,0,0,0,"",1,"","",emo_parameters.2024-01-24-1948.data.4d4a3afb-d7a0-4e43-9855-0af6fd29b2f1.txt,1,"Nein, es war alles verständlich.",4,2,1,5,1,5,5,1,"Betonung der Silben, Melodie im Pseudowort, Singsang im Pseudowort, schnelle oder langsame Aussprache des Pseudoworts",ModularPROMS.2024-01-24-2014.data.4d4a3afb-d7a0-4e43-9855-0af6fd29b2f1.txt,3,2,2,3,2,2,4,2,2,2,2,2,3,3,3,2,1,4,1,4,4,2,4,3,1,2,1,2,4,3,1,3,4,4,3,3,3,3,3,2,3,4,2,1,3,2,3,2,3,2,4,4,1,3,5,2,1,3,2,3,4,4,5,4,3,2,3,5,4,1,4,5,5,4,4,2,2,2,3,3,7,4,5,2,6,5,6,5,1,6,6,7,1,1,7,7,2,6,6,7,1,6,1,6,5,6,1,7,5,3,7,30,3,7,6,4,2,3,Bariton,9,2,2,"",2,6,4,5,DDR  / BR Deutschland,Deutschland,3,3,4,3,1,3,1,1,1,3,3,2,3,1,3,1,3,3,1,1,A,A,Z,2,4,E,"",2024-01-24-19-23,2024-01-24-20-33,70
s.86f85893-7715-48cf-8fd7-db01c2777d5e.txt,0106023,22,1,1,Studium: Master Grundschullehramt mit Schwerpunktfach Englisch,1,1,0,0,0,0,0,"",1,"","",emo_parameters.2023-11-23-1435.data.86f85893-7715-48cf-8fd7-db01c2777d5e.txt,1,"-Instruktionen verständlich~~-vielleicht hätte man Freude F und Genuss D machen können, das fand ich anfangs verwirrend, aber irgendwann hat man sich auch daran gewähnt und es war sehr hilfreich, dass das bei jeder Aufgabe auch nochmal durnter stand",3,4,3,5,2,4,5,4,"-anfangs fiel es mir schwer die Wörter auszublenden~~-hab nach und nach immer mehr gedrückt, was ich ""gefühlt"" der Person zuordnen würde; man Kopf hat also auch viel mit den Gefühlen/Intuitionen zusammengearbeitet und nicht mehr ""die Oberhand"" gehabt",ModularPROMS.2023-11-23-1509.data.86f85893-7715-48cf-8fd7-db01c2777d5e.txt,2,3,1,2,2,3,4,1,2,3,2,2,2,2,2,2,1,3,4,3,4,3,3,1,2,2,2,2,2,1,2,3,3,2,3,2,2,2,3,1,2,3,2,2,2,2,2,2,3,1,5,5,4,3,4,2,1,2,2,3,4,5,4,4,3,2,2,4,3,3,4,4,3,3,3,3,2,2,1,2,6,5,2,2,5,5,5,6,1,6,3,5,3,2,6,6,5,6,5,5,4,5,3,7,3,3,4,4,3,5,5,15,3,5,7,11,4,3,Gesang,7,2,2,"",2,6,7,3,Deutschland,Deutschland,2,1,3,2,1,1,1,1,1,2,2,1,2,1,3,1,1,3,2,1,U,L,H,1,1,I,"der Musiktest war teilweise etwas anstrengend, vielleicht hätte man da nochmal eine Pause bei jeder Musikaufgabe nach der Hälfte kurz machen können",2023-11-23-14-05,2023-11-23-15-37,92
s.9d5651f3-e3b0-4a5e-9b9f-a91d04ee791f.txt,0106023,36,2,1,Landwirt,1,1,0,0,0,0,0,"",1,"","",emo_parameters.2023-07-04-2039.data.9d5651f3-e3b0-4a5e-9b9f-a91d04ee791f.txt,1,alles wunderbar,5,3,2,4,2,5,5,1,ab etwa dem dritten durchlauf habe ich die länge der silben der pseudowörter als aussagekräftiges indiz festgelegt um z.b. angst von trauer bzw. genuss von freude zu unterscheiden.,ModularPROMS.2023-07-04-2112.data.9d5651f3-e3b0-4a5e-9b9f-a91d04ee791f.txt,3,3,2,2,2,1,2,3,4,1,2,3,3,2,1,1,1,2,2,2,4,3,1,2,2,3,3,1,3,3,2,1,2,1,2,4,1,2,3,4,4,2,3,2,2,3,2,3,2,3,3,3,4,4,5,3,4,4,3,2,3,4,3,4,4,3,2,3,3,1,3,4,5,3,4,2,3,3,3,2,6,2,1,2,6,5,5,6,2,6,3,6,2,1,3,3,4,6,5,4,3,6,2,6,1,6,3,2,3,5,5,0,5,6,1,30,1,5,Gesang,0,2,2,"",2,6,7,1,Deutschland,Deutschland,3,2,3,3,1,3,1,1,1,4,2,1,2,1,2,1,3,5,1,2,E,B,J,1,3,A,"",2023-07-04-20-12,2023-07-04-21-44,92
s.6eff8c46-33f7-4dd7-a113-e5a485cb5366.txt,"","","","","","","","","","","","","","","","","","","","","","","","","","","","","","","","","","","","","","","","","","","","","","","","","","","","","","","","","","","","","","","","","","","","","","","","","","","","","","","","","","","","","","","","","","","","","","","","","","","","","","","","","","","","","","","","","","","","","","","","","","","","","","","","","","","","","","","","","","","","","","","","","","","","","","","","","","","","","","","","","","","","","","","","","","","","","","","","","","","","","","","","","",2024-01-17-21-23,"",""
s.c81cc6b3-4f4c-44ee-acdc-0709d4970135.txt,0106023,21,2,1,B.Sc. Physik,1,1,0,0,0,0,0,"",1,"","",emo_parameters.2023-07-18-1955.data.c81cc6b3-4f4c-44ee-acdc-0709d4970135.txt,1,"-Instruktionen waren verständlich, allerdings war es anfangs (trotz Übung) schwierig sich so schnell zu erinnern, welche Antwortmöglichkeiten zur Verfügung stehen und sich für die zutreffendste Emotion zu entscheiden~~-manchmal (v.a. Genuss vs. Trauer) war es nicht leicht sich zu entscheiden~~-beim ersten Durchgang im Hauptteil sind die Antworten teilweise nicht registriert worden",2,3,3,5,3,3,5,4,"-zuerst habe ich versucht darauf zu achten ob das Audio eher positiv (Genuss, Freude) oder negativ (Angst, Trauer) klingt, um anschließend feiner zu unterscheiden~~",ModularPROMS.2023-07-18-2046.data.c81cc6b3-4f4c-44ee-acdc-0709d4970135.txt,3,2,2,2,4,4,4,2,4,3,4,4,3,4,2,3,4,4,2,4,3,1,4,3,1,1,3,3,2,1,2,4,3,3,3,2,2,4,4,1,1,3,2,3,3,2,3,3,1,3,5,4,3,4,5,1,1,4,3,1,2,2,3,3,2,1,2,4,3,3,4,5,5,2,5,4,2,3,1,4,5,4,1,3,6,6,6,6,2,6,2,5,2,1,6,6,5,6,5,4,4,6,6,2,3,6,2,3,3,3,5,13 (nicht täglich),3,5,1,10,2,2,Ich spiele seit 13 Jahren Klavier und singe im Chor und kann nicht sagen was ich besser kann,8,2,2,"",2,6,1,4,Deutschland,Deutschland,3,3,3,2,2,1,2,2,1,1,2,1,2,2,2,2,2,2,2,3,U,U,E,8,2,A,"",2023-07-18-19-26,2023-07-18-21-48,142
s.fe7f5ae3-cfc4-4494-8d87-d674e68d07f8.txt,0106023,23,2,1,Lehramt Gymnasium,1,1,0,0,0,0,0,"",1,"","","","","","","","","","","","","","","","","","","","","","","","","","","","","","","","","","","","","","","","","","","","","","","","","","","","","","","","","","","","","","","","","","","","","","","","","","","","","","","","","","","","","","","","","","","","","","","","","","","","","","","","","","","","","","","","","","","","","","","","","","","","","","","","","","","","","","","","","","","","","","","","","","","","","","","","","","","","","","","","","","","","","","","","","","","",2023-11-16-16-31,"",""
s.24815c8e-727c-4f25-94cc-4c7d1fcd9703.txt,0106023,21,1,1,Medizintechnik,2,0,0,1,0,0,0,"",1,"","",emo_parameters.2023-11-17-1139.data.24815c8e-727c-4f25-94cc-4c7d1fcd9703.txt,1,-zittern in der Stimme der Personen gewollt oder Aufnahmefehler?,4,3,2,5,4,3,5,2,"-ob Stimme am Ende hoch oder runter geht~~-ob Stimme gedämpft (""verheult"") klingt~~-Gesichter vor dem inneren Auge vorstellen und assoziieren in welcher Situation sie welche Laute von sich gegeben haben",ModularPROMS.2023-11-17-1205.data.24815c8e-727c-4f25-94cc-4c7d1fcd9703.txt,1,3,2,3,4,1,2,1,1,2,1,1,4,3,2,1,2,2,1,3,4,4,2,3,1,4,2,2,4,3,1,1,3,2,4,2,2,1,1,4,2,4,1,1,4,2,1,2,4,3,1,4,3,3,5,5,5,1,3,2,5,4,5,4,5,5,1,4,2,1,1,5,5,5,5,1,5,2,4,1,6,5,1,1,6,7,7,7,2,5,2,7,1,1,5,7,4,7,5,3,3,6,3,6,7,6,3,7,7,2,7,15,3,5,5,15,6,5,Gitarre,6,1,2,"",2,6,1,3,Deutschland,Deutschland,5,2,5,5,1,5,2,2,1,5,5,2,4,2,3,2,5,4,3,2,N,O,J,8,2,A,"",2023-11-17-11-22,2023-11-17-12-18,56
s.0a5d940b-4700-4459-bc28-429b3d3bbe78.txt,0106023,24,1,1,Sonderpädagogik,2,0,1,1,0,0,0,"",1,"","",emo_parameters.2024-01-25-1052.data.0a5d940b-4700-4459-bc28-429b3d3bbe78.txt,1,alles ok,5,3,2,4,2,3,5,1,"Angst und Freude waren einfach für micht. Alles was ich nicht sofort zuordnen konnte, waren dann Trauer oder Genuss",ModularPROMS.2024-01-25-1118.data.0a5d940b-4700-4459-bc28-429b3d3bbe78.txt,1,1,2,3,2,4,3,1,4,2,2,2,2,3,1,1,2,3,4,4,3,2,4,1,3,2,2,3,1,3,2,2,4,3,3,2,2,1,4,2,4,4,1,2,3,2,2,2,1,1,5,5,2,4,5,3,2,3,1,2,4,5,5,5,3,3,1,4,4,2,3,5,4,2,3,3,2,2,2,2,7,7,2,6,3,6,5,5,1,3,4,5,1,1,6,5,1,6,4,5,2,5,3,5,6,5,2,5,3,4,6,15,5,6,3,12,4,3,Bassposaune,4,1,2,"",2,6,1,4,Deutschland,Deutschland,4,1,5,3,1,4,1,1,1,4,4,2,3,1,3,1,3,4,1,1,N,I,Z,9,0,E,"",2024-01-25-10-28,2024-01-25-11-35,67
s.b2bdae41-0dc8-4150-a5f7-63b7dba29b75.txt,0106023,26,2,1,Jura,1,0,0,0,1,0,0,"",2,Tinnitus,1,emo_parameters.2023-06-12-1012.data.b2bdae41-0dc8-4150-a5f7-63b7dba29b75.txt,1,Instruktionen waren verständlich.,5,2,1,5,1,4,5,1,Bauchgefühl,ModularPROMS.2023-06-12-1039.data.b2bdae41-0dc8-4150-a5f7-63b7dba29b75.txt,1,2,3,4,2,2,4,3,3,3,2,1,4,4,3,3,2,4,3,4,3,2,2,3,2,2,1,3,3,3,2,3,4,3,4,2,2,2,4,2,1,4,2,2,3,2,3,1,3,3,4,4,1,5,3,4,1,5,5,2,3,2,5,4,2,2,2,5,4,2,3,4,5,1,5,2,2,1,2,3,5,5,1,3,7,5,6,3,2,6,2,6,3,2,2,5,5,7,5,5,5,7,2,3,4,4,4,3,3,4,6,10,2,5,4,10,3,1,Gesang,7,2,2,"",2,6,9,5,Deutschland,Deutschland,3,2,4,3,1,3,1,1,1,3,2,2,3,1,5,2,3,4,1,1,A,E,B,9,1,O,"",2023-06-12-09-37,2023-06-12-11-02,85
s.aba628f9-002b-431e-bb4e-7fa8a83a560b.txt,0106023,25,2,1, Doktorand der Bioinformatik,2,0,1,0,0,0,0,"",1,"","",emo_parameters.2023-11-26-1655.data.aba628f9-002b-431e-bb4e-7fa8a83a560b.txt,1,* Instruktionen waren verständlich~~* viele Stimmen waren sehr ähnlich,3,4,2,4,1,4,5,3,* ich habe die Tonhöhe der Stimme am Ende mit der Tonhöhe der Stimme am Anfang verglichen~~* nach unten: Trauer~~* nach oben: Freude~~* zittrige Stimme: ANgst~~* gleiches Tonlevel: Genuss,ModularPROMS.2023-11-26-1725.data.aba628f9-002b-431e-bb4e-7fa8a83a560b.txt,3,1,2,2,1,1,4,2,2,2,3,2,2,3,3,1,4,4,1,3,3,2,1,4,4,2,4,3,4,1,3,3,2,4,1,4,2,3,3,4,1,2,1,3,2,1,4,1,3,4,5,3,2,5,4,3,3,2,5,1,3,4,4,2,2,1,3,5,2,5,2,5,5,2,5,4,2,2,2,4,5,1,1,1,5,6,7,2,3,6,3,6,2,1,5,7,2,6,5,6,6,5,3,4,6,2,5,1,5,2,6,12,4,1,1,12,2,3,Geige,6,2,2,"",2,6,9,1,Deutschland,Deutschland,5,2,5,2,1,2,3,1,1,3,3,1,3,2,5,2,5,5,1,4,H,Ä,M,2,2,T,"",2023-11-26-16-34,2023-11-26-17-50,76
s.c212dfe1-4bc2-4304-a51b-4fd6beac6eba.txt,0106023,30,1,1,Bauzeichnerin,1,1,0,0,0,0,0,"",1,"","",emo_parameters.2023-11-03-2224.data.c212dfe1-4bc2-4304-a51b-4fd6beac6eba.txt,1,"",4,3,1,4,2,4,5,1,"Melodie des Wortes abtasten nach Mustern, verschiedene Melodien finden sich in bestimmten Emotionsausdrücken wieder",ModularPROMS.2023-11-03-2253.data.c212dfe1-4bc2-4304-a51b-4fd6beac6eba.txt,2,1,3,3,2,2,4,1,2,4,2,3,2,4,1,2,1,2,1,3,2,2,1,4,4,2,4,4,4,3,4,4,3,3,1,4,3,1,3,2,4,3,2,2,3,1,2,2,1,4,3,4,4,5,5,3,5,5,4,2,2,4,3,1,3,4,4,5,2,1,4,5,2,3,4,4,4,3,5,4,5,7,3,2,6,7,7,5,1,6,3,6,1,1,5,6,6,7,5,6,7,7,1,7,5,7,6,3,6,6,7,7,2,4,1,7,3,3,Gesang,8,2,2,"",2,6,1,1,Deutschland,Deutschland,3,2,3,2,2,4,2,1,1,4,3,2,1,1,2,2,3,4,3,2,A,E,J,3,5,H,"",2023-11-03-22-04,2023-11-03-23-05,61
s.78315209-272b-4b0a-94b8-bda6b7d815e5.txt, 0106023,28,1,1,wissenschaftliche Mitarbeiterin ev. Theologie,1,1,0,0,0,0,0,"",1,"","",emo_parameters.2023-10-25-1830.data.78315209-272b-4b0a-94b8-bda6b7d815e5.txt,1,Die Stimmen waren gewöhungsbedürftig und ließen Interpretationsspielraum,4,3,2,2,2,2,5,1,"Die Melodie in der Stimme und ""Atmung"" (fiel wegen der künstlichen Stimmen schwer)",ModularPROMS.2023-10-25-1857.data.78315209-272b-4b0a-94b8-bda6b7d815e5.txt,3,2,1,2,1,1,4,2,4,3,2,1,1,2,2,1,2,3,3,3,4,4,2,3,3,3,2,3,2,3,2,2,1,3,3,2,2,2,4,2,4,3,1,2,3,3,2,2,4,2,3,4,1,4,5,5,2,2,1,3,4,4,5,3,4,3,1,5,3,1,2,5,5,3,5,2,3,1,2,1,6,3,2,2,7,7,7,2,2,7,1,7,2,1,1,1,5,7,6,6,7,7,1,3,3,5,7,1,5,3,5,24,3,3,1,13,3,1,Geige,5,2,2,"",2,6,9,1,Deutschland,Deutschland,4,1,4,4,1,2,1,1,1,3,1,1,3,1,3,1,3,4,1,1,a,n,b,2,9,r,"Die Anweisung für den Melodietest war mir nicht auf Anhieb klar (welche Melodien sollen miteinander verglichen werden). Nach dem Testbeispiel wäre es hilfreich gewesen, nochmal die Anweisung zu lesen.",2023-10-25-18-06,2023-10-25-19-14,68
s.ac9e6a96-790f-4eb3-9e13-53b2fd6f6b98.txt,0106023,27,1,1,M.Eng. Maschinenbau,2,0,1,0,0,0,0,"",1,"","","","","","","","","","","","","","","","","","","","","","","","","","","","","","","","","","","","","","","","","","","","","","","","","","","","","","","","","","","","","","","","","","","","","","","","","","","","","","","","","","","","","","","","","","","","","","","","","","","","","","","","","","","","","","","","","","","","","","","","","","","","","","","","","","","","","","","","","","","","","","","","","","","","","","","","","","","","","","","","","","","","","","","","","","","",2023-10-25-15-46,"",""
s.39460d2e-83d8-4d3e-9fe8-b948552e0861.txt,0106023,44,2,1,Physiker,2,0,1,0,0,0,1,Trio / Quartett,1,"","",emo_parameters.2024-01-24-1848.data.39460d2e-83d8-4d3e-9fe8-b948552e0861.txt,1,"Hab mir am Anfang die Buchstabenbelegung notiert, ein Hinweis, dass die noch eingeblendet wird, wäre gut gewesen.",5,2,1,5,1,2,5,1,"Ich bin mal davon ausgegangen, dass das anständig ranndomisiert war, insofern schien mir eine Strategie wenig sinnvoll. Das hätte ja auch den Spontancharakter gestört. Bewertung ging viel nach Melodie oder Timbre. Nur die ganz tiefe Stimme schien immer ""Genuss"" zu sagen...",ModularPROMS.2024-01-24-1916.data.39460d2e-83d8-4d3e-9fe8-b948552e0861.txt,2,2,1,3,2,2,4,1,2,2,1,1,3,2,1,3,2,3,1,4,4,2,1,2,2,3,2,2,3,3,2,3,3,3,4,3,3,2,3,1,3,4,3,1,2,2,3,3,4,1,4,4,4,3,4,3,3,5,3,1,2,4,4,4,5,3,1,2,3,4,3,5,4,3,5,4,4,2,2,2,7,5,1,5,6,7,7,3,1,7,1,6,2,1,3,3,5,7,6,5,5,7,1,5,2,6,1,3,6,5,6,0,3,5,5,13,3,1,Cello,6,2,2,"",2,6,10,4,Deutschland,Deutschland,1,3,3,2,1,1,1,1,1,2,3,1,2,2,2,1,1,3,1,2,I,L,E,7,0,O,"Zur Frage nach der Erfahrung am Instrument: regelmäßig sind das bei mit 34 Jahre, aber täglich sind es 0...~~Bei den Hörtests wäre es sinnvoll gewesen, wenn man eine Idee hätte, wie klein die Details sein können. Ein halbes Hertz, oder eher ein Halbton?",2024-01-24-18-23,"",""
s.1e47febe-c6ca-4574-981a-52b0f68d9943.txt,0106023,21,1,1,Medizintechnik,2,0,1,0,0,0,0,"",1,"","",emo_parameters.2023-10-29-1453.data.1e47febe-c6ca-4574-981a-52b0f68d9943.txt,3,"- Instruktion verständlich~~- einige Ausrufe vehr eindeutig, einige nicht möglich zuzuordnen",4,2,3,5,2,4,5,2,- ich hatte keine Strategie,ModularPROMS.2023-10-29-1524.data.1e47febe-c6ca-4574-981a-52b0f68d9943.txt,2,2,1,3,1,4,4,1,4,2,3,2,2,2,2,2,1,3,3,4,2,2,2,1,1,3,2,3,2,3,1,2,3,1,2,2,3,2,4,1,4,4,1,2,2,3,2,2,3,3,3,4,1,3,4,4,2,5,1,3,4,5,5,5,4,4,2,5,3,1,3,5,3,4,4,5,3,2,3,2,6,3,1,5,7,7,7,6,1,7,1,7,1,1,6,5,6,7,5,6,3,7,1,7,1,7,1,2,6,5,7,13,3,7,1,11,2,2,"Cello, Gesang",7,2,2,"",2,6,1,1,Deutschland,Deutschland,3,1,3,4,1,3,1,1,1,3,4,1,3,1,4,1,3,3,2,1,E,H,A,9,4,A,-,2023-10-29-14-35,2023-10-29-15-43,68
s.ca13c482-ce4c-4a44-a637-f1462e65ce6e.txt,0106023,18,1,1,noch in der Schule,2,0,1,0,0,0,0,"",1,"","",emo_parameters.2023-11-13-1614.data.ca13c482-ce4c-4a44-a637-f1462e65ce6e.txt,1,alles verständlich,4,3,2,5,2,3,3,1,"Bewertung nach Tonhöhe und ihrem Verlauf, Brüchigkeit der Stimme,Länge eines Klangs",ModularPROMS.2023-11-13-1645.data.ca13c482-ce4c-4a44-a637-f1462e65ce6e.txt,4,4,1,4,3,3,4,2,2,2,1,1,4,2,1,3,2,3,3,4,3,4,3,2,1,4,2,4,3,3,2,2,4,2,3,2,2,1,3,1,3,4,4,1,3,4,1,2,4,2,2,4,4,3,5,2,1,4,3,1,5,5,5,2,3,5,1,5,3,1,2,5,4,4,4,2,2,2,1,1,7,5,1,5,6,7,7,6,1,7,3,6,1,2,5,5,3,6,5,5,2,5,3,5,1,7,3,5,3,2,7,2,4,7,1,"einmal 2, einmal 3",6,3,Waldhorn,"8, zuletzt mit 16",2,2,"",2,1,3,5,Deutschland,Deutschland,3,3,3,2,1,3,1,1,1,4,2,1,2,1,2,1,3,3,2,1,U,E,B,1,4,H,"",2023-11-13-15-52,2023-11-13-17-17,85
s.0e088474-02d9-46b8-b919-c82bb2a5db19.txt,0106023,19,1,1,Kommunikationswissenschaft und Englisch,1,1,0,0,0,0,0,"",1,"","",emo_parameters.2023-11-01-1041.data.0e088474-02d9-46b8-b919-c82bb2a5db19.txt,1,"",4,4,3,5,2,3,4,1,- zunächst nach Freude & Genuss sowie Trauer & Angst und danach konkret entschieden,ModularPROMS.2023-11-01-1109.data.0e088474-02d9-46b8-b919-c82bb2a5db19.txt,3,2,3,2,2,3,4,3,4,2,3,1,2,1,3,2,2,3,4,2,4,2,2,1,4,1,2,3,2,3,2,2,3,3,2,2,3,3,4,2,3,3,1,3,3,1,2,2,2,2,2,4,2,5,5,5,2,3,3,1,4,2,5,1,5,2,2,4,1,1,2,5,4,3,4,4,2,1,1,1,7,7,4,5,6,6,7,6,1,7,1,7,1,1,7,7,7,7,6,6,1,6,2,7,1,6,1,6,5,2,7,10,5,4,1,10,3,3,Gesang,5,2,2,"",2,6,1,3,Deutschland,Deutschland,2,1,4,2,1,2,1,1,1,1,2,2,3,1,3,2,2,3,2,1,U,E,A,0,4,N,"",2023-11-01-10-15,2023-11-01-11-29,74
s.93c26790-e69b-42ae-b441-4159c2efc2bd.txt,0106023,30,2,1,Physiker,1,1,0,0,0,0,0,"",1,"","",emo_parameters.2023-11-13-1358.data.93c26790-e69b-42ae-b441-4159c2efc2bd.txt,1,alles verständlich,4,2,2,5,1,5,5,2,Bauchgefühl~~Heben bzw senken der Stimme am Wortende~~Tonlage~~Zittern in der Stimme bei Angst,ModularPROMS.2023-11-13-1427.data.93c26790-e69b-42ae-b441-4159c2efc2bd.txt,2,2,1,3,3,4,4,1,3,2,1,3,4,1,1,1,1,2,1,4,3,3,1,2,2,3,2,2,1,3,1,1,3,2,4,2,2,1,3,1,4,3,3,1,3,4,2,2,3,1,4,4,5,4,5,3,1,5,1,1,3,5,5,4,3,5,1,3,4,2,3,5,4,5,5,2,3,3,1,2,5,6,1,6,7,7,7,3,1,7,2,6,2,1,3,6,5,7,5,5,4,6,1,3,1,5,2,6,5,5,6,10,4,5,1,3,4,3,Gesang,8,2,2,"",2,6,9,4,Deutschland,Deutschland,3,1,3,2,1,3,1,1,1,3,4,1,3,1,4,1,3,4,2,1,A,K,G,7,4,N,"",2023-11-13-13-36,2023-11-13-14-50,74
s.d329868c-82f4-4972-bf6b-d42176e8cb48.txt,0106023,53,2,1,Physiker,1,1,0,0,0,0,1,Solo Gitarre,1,"","",emo_parameters.2023-11-05-1339.data.d329868c-82f4-4972-bf6b-d42176e8cb48.txt,1,"Wenn man zu früh gedrückt hat regierte es nicht und wenn man die Augen zu hatte, hat das dann zu unrealistisch langen Antwortzeiten geführt. Manchmal war unklar, ob das Zittern in der Stimme vom Coputereffekt oder vor einem beabsichtigtem Zittern (Angst?) kam.",4,2,2,5,2,4,5,1,Mit der Zeit hat man mehr aktiv (bewusst) auf die Melodie gehört.,ModularPROMS.2023-11-05-1408.data.d329868c-82f4-4972-bf6b-d42176e8cb48.txt,2,3,1,1,3,2,2,2,4,3,2,3,4,2,2,2,3,2,1,3,3,3,2,2,1,3,3,2,1,1,2,3,2,2,3,3,2,2,3,2,3,2,4,2,2,3,1,3,2,2,2,3,5,3,4,4,3,4,1,1,4,4,3,4,5,4,2,2,4,3,2,4,4,4,5,2,4,2,2,1,5,5,1,5,6,5,6,6,2,6,2,5,3,2,5,5,6,7,5,4,5,6,2,5,2,5,4,2,5,3,5,14,2,5,1,25,4,1,Gitarre,7,2,2,"",2,6,10,5,Deutschland,Deutschland,3,1,4,2,1,2,1,1,1,2,3,1,2,1,3,1,3,3,1,1,A,I,L,0,1,U,"Bei einer Frage war ein Schreibfehler in der Frage, so dass nicht sofort klar war was gemeint ist. Aus dem Kontext konnte man es aber erschliessen.",2023-11-05-13-10,2023-11-05-14-32,82
s.95baa12e-8dc4-4c76-98f2-947a36d3024f.txt,0106023,22,1,1,Germanistik mit Sprechwissenschaft/Phonetik B. A.,1,1,0,0,0,0,0,"",1,"","",emo_parameters.2023-11-01-0954.data.95baa12e-8dc4-4c76-98f2-947a36d3024f.txt,1,alles verständlich!,5,2,1,5,2,5,5,1,"Augen geschlossen, mich ganz auf die Stimme konzentriert und versucht zu fühlen, nicht denken.",ModularPROMS.2023-11-01-1018.data.95baa12e-8dc4-4c76-98f2-947a36d3024f.txt,2,1,1,3,1,2,3,2,2,2,3,2,1,2,1,1,2,3,2,4,4,3,2,4,4,3,1,3,2,4,2,3,2,3,3,2,3,2,2,2,2,4,1,2,4,1,2,1,3,2,5,5,2,5,5,4,3,3,1,4,4,4,5,4,4,3,1,5,3,2,4,5,5,4,4,4,3,2,2,2,5,7,2,5,6,6,6,3,1,5,5,3,2,3,2,6,5,5,3,6,6,5,3,5,3,4,2,3,3,4,7,4,2,2,3,8,3,2,Gesang,8,2,2,"",2,6,1,4,Deutschland,Deutschland,3,1,5,4,1,1,1,2,1,4,3,1,4,1,4,1,3,5,2,1,O,L,B,4,0,I,"",2023-11-01-09-36,2023-11-01-10-31,55
s.b20f943b-244f-4375-b15f-c14cc496e75c.txt,"","","","","","","","","","","","","","","","","","","","","","","","","","","","","","","","","","","","","","","","","","","","","","","","","","","","","","","","","","","","","","","","","","","","","","","","","","","","","","","","","","","","","","","","","","","","","","","","","","","","","","","","","","","","","","","","","","","","","","","","","","","","","","","","","","","","","","","","","","","","","","","","","","","","","","","","","","","","","","","","","","","","","","","","","","","","","","","","","","","","","","","","","",2023-10-20-01-39,"",""
s.b4e1cdec-8c15-4ea2-88c8-b03c34bc7021.txt,0106023,20,1,1,BA Kommunikationswissenschaft und Interkulturelles Musik- und Veranstaltungsmanagement,1,1,0,0,0,0,0,"",1,"","",emo_parameters.2023-06-30-1510.data.b4e1cdec-8c15-4ea2-88c8-b03c34bc7021.txt,1,"teilweise sehr verzerrt, zu beginn Kopfhörerlautstärke zu leise",3,2,1,5,1,5,5,1,"Brechen und Zittern der Stimme, Klangmelodie",ModularPROMS.2023-06-30-1536.data.b4e1cdec-8c15-4ea2-88c8-b03c34bc7021.txt,2,1,1,2,1,4,3,3,4,1,3,1,3,2,2,1,1,3,4,4,4,1,3,1,1,3,2,1,2,3,2,1,3,1,4,2,1,1,2,2,4,3,2,3,2,2,2,3,3,3,3,2,4,5,5,4,3,5,3,3,3,2,4,5,2,3,4,5,5,4,2,5,4,4,4,3,4,2,3,2,7,6,1,7,7,7,7,3,1,7,1,7,1,1,6,7,5,7,6,6,2,7,1,6,2,6,2,6,7,7,7,15,3,7,4,12,3,3,Gesang,7,1,2,"",2,6,1,5,Deutschland,Deutschland,3,1,4,3,1,4,1,1,1,3,1,1,1,1,3,1,2,5,1,1,O,Y,D,0,7,A,"",2023-06-30-14-47,2023-06-30-15-54,67
s.0c760dab-4b3b-43d1-b4b8-7ba65846c1bb.txt,0106023,28,2,1,Kinder- und Jugendmedien,1,1,0,0,0,0,0,"",1,"","",emo_parameters.2023-11-26-1438.data.0c760dab-4b3b-43d1-b4b8-7ba65846c1bb.txt,1,Instruktionen waren für mich vollkommen verständlich,4,3,2,5,2,5,5,2,"- ich habe versucht, anhand der Betonung der Wörter und der Sprechmelodie zu bewerten~~- dabei habe ich mir vorgestellt, wie ich mich selber in den jeweiligen Emotionen anhören würde und versucht, dies als Referenz zu nehmen~~- dort, wo ich mir nicht sicher war, habe ich spontan nach Gefühl entschieden",ModularPROMS.2023-11-26-1513.data.0c760dab-4b3b-43d1-b4b8-7ba65846c1bb.txt,2,2,1,2,2,3,4,1,4,2,1,2,4,2,2,2,2,3,2,3,3,4,2,2,2,3,3,3,3,3,2,2,4,1,3,3,2,1,4,1,3,4,2,1,3,3,1,2,3,1,3,5,2,2,5,3,1,3,1,2,4,5,5,4,3,5,1,5,4,2,3,5,4,4,4,1,2,2,2,2,7,6,3,6,6,6,7,6,2,7,2,6,1,1,6,7,7,6,6,6,5,6,1,6,2,6,1,5,6,5,6,16,5,7,3,6,3,3,Gesang,12,2,2,"",2,6,7,2,Deutschland,Deutschland,3,1,4,4,1,3,1,1,1,2,4,1,4,1,4,1,3,5,1,1,I,N,B,5,5,E,"",2023-11-26-14-09,2023-11-26-15-43,94
s.3dbd59e9-c618-4bbd-a97f-a2abe9fe9c2d.txt,0106023,43,1,1,Ärztin,2,0,1,0,0,0,0,"",3,Leichte Schwerhörigkeit,2,"","","","","","","","","","","","","","","","","","","","","","","","","","","","","","","","","","","","","","","","","","","","","","","","","","","","","","","","","","","","","","","","","","","","","","","","","","","","","","","","","","","","","","","","","","","","","","","","","","","","","","","","","","","","","","","","","","","","","","","","","","","","","","","","","","","","","","","","","","","","","","","","","","","","","","","","","","","","","","","","","","","","","","","","","",2023-11-19-16-46,"",""
s.fca2d4b5-8ddb-4079-9a12-6d8edc760a5d.txt, 0106023,29,1,1,Projektkoordinatorin,1,1,0,0,0,0,0,"",1,"","",emo_parameters.2024-01-09-1204.data.fca2d4b5-8ddb-4079-9a12-6d8edc760a5d.txt,1,alles verständlich,4,2,2,5,2,5,5,2,"Tonlagen, Intonationskurven, Zittrigkeit/ Weinerlichkeit d. Stimme versucht zu erkennen und einzuordnen",ModularPROMS.2024-01-09-1233.data.fca2d4b5-8ddb-4079-9a12-6d8edc760a5d.txt,1,2,2,2,3,2,3,2,3,2,1,2,3,3,1,1,1,2,3,3,3,2,2,1,2,3,2,2,2,3,2,2,2,2,2,2,2,1,3,2,2,3,2,1,3,2,1,2,2,2,3,5,4,3,5,4,3,3,2,2,4,5,4,3,4,4,1,4,3,1,2,4,4,3,4,2,3,2,3,2,5,4,2,5,5,5,6,6,2,5,3,5,3,3,4,5,3,5,5,5,5,5,2,3,2,5,2,3,4,4,6,18,4,6,1,11,4,2,Gesang,8,2,2,"",2,6,9,2,Deutschland,Deutscland,4,2,4,4,2,3,2,1,1,3,3,2,3,2,3,1,4,3,2,1,O,O,D,1,8,E,"",2024-01-09-11-32,2024-01-09-13-02,90
s.d08e78cd-093d-4858-86a5-72c81dd171b3.txt,0106023,27,2,1,Musikwissenschaft (M.A.) (abgeschlossen),2,0,1,1,0,0,0,"",1,"","",emo_parameters.2024-01-25-1511.data.d08e78cd-093d-4858-86a5-72c81dd171b3.txt,1,Sehr verständlich.,5,3,1,5,1,5,5,1,"Ich habe mich darauf konzentriert, mir zu den Stimmen ein Gesicht oder eine Person vorzustellen, dann darauf geachtet, ob sie eine der Stimmungen verkörpert.",ModularPROMS.2024-01-25-1540.data.d08e78cd-093d-4858-86a5-72c81dd171b3.txt,1,2,1,2,2,3,4,1,4,2,1,1,2,2,3,1,2,3,4,4,3,4,2,4,1,2,2,4,1,2,1,4,4,2,4,3,2,1,3,3,1,4,1,1,3,2,2,1,1,3,2,5,3,5,5,3,1,3,4,1,4,1,5,2,5,4,1,3,3,2,4,5,4,3,5,1,2,4,2,2,6,6,3,6,5,7,7,7,1,6,7,6,1,1,5,4,5,6,6,5,4,6,2,6,5,7,1,6,6,5,6,15,6,3,6,15,4,3,Saxophon,6,2,1,2,2,6,9,2,Deutschland,Deutschland,3,3,4,2,2,3,1,2,2,3,1,2,4,1,4,4,2,3,3,3,A,E,B,5,6,L,"",2024-01-25-14-42,2024-01-25-16-05,83
s.35ee4382-b985-49ad-866a-b68e99a3afac.txt,0106023,27,2,1,Förderschullehramt,2,0,1,1,0,0,0,"",1,"","",emo_parameters.2024-01-19-1307.data.35ee4382-b985-49ad-866a-b68e99a3afac.txt,1,Nächstes mal gerne vorher sagen das alle Auswahlmöglichkeiten dauerhaft zu sehen sind.,5,3,2,5,1,4,5,1,"Beim Dritten Durchlauf fing ich an die Emotionen in positiv und negativ zu gewichten. Positiv =Freude, Genuss, Negativ = Angst, Trauer. Nach der Entscheidung habe ich zwischen den positiven bzw negativen Ergebnissen entschieden. ",ModularPROMS.2024-01-19-1333.data.35ee4382-b985-49ad-866a-b68e99a3afac.txt,1,3,2,2,3,4,3,1,3,1,1,2,4,4,1,1,2,3,1,4,4,4,2,1,2,3,1,1,1,2,1,3,3,2,3,2,3,1,3,1,2,3,2,1,3,3,1,1,1,2,5,4,4,3,5,3,2,5,3,2,3,5,5,5,3,4,1,4,4,1,3,5,3,3,4,2,3,4,2,4,7,6,1,4,6,7,3,7,2,4,2,7,2,2,6,7,2,6,4,5,1,6,3,7,4,6,3,6,1,5,6,22,2,6,3,18,5,5,Posaune,4,2,2,"",2,6,7,4,Deutschland,Deutschland,3,2,4,4,1,3,1,1,1,4,2,2,4,1,3,1,4,4,1,1,i,n,a,2,8,n,"",2024-01-19-12-45,2024-01-19-13-52,67
